{
  "system_code": "THESHARE",
  "environment": "TEST",
  "flow_type": "SYNC",
  "provider_code": "HYPERPAY",
  "end_point": "/v1/url",
  "http_method": "POST",
  "request_details": [
    {
      "internal_code": "PAYMENT_202",
      "headers": [
        {
          "name": "Content-Type",
          "value": "application/x-www-form-urlencoded",
          "seq": 1
        }
      ],
      "body": "amount=10875.00&currency=SAR&paymentType=DB&merchantTransactionId=202"
    }
  ]
}